i,title,cosine_similarity,euclidean_distance
0,SYSTEM FOR CONNECTING IMPLEMENT TO MOBILE MACHINERY,0.8424431085586548,8.29971981048584
1,PEST CONTROL COMPOSITION,0.6143521070480347,5.798821926116943
2,LAVAGE DEVICE,0.8807299733161926,8.094399452209473
3,"Cabin Arrangement For An Aircraft, And Aircraft",0.9620414972305298,9.550844192504883
4,AUTOMATED PHYSICAL NETWORK MANAGEMENT SYSTEM UTILIZING HIGH RESOLUTION RFID AND OPTICAL SCANNING FOR RFID TAG SPATIAL LOCALIZATION,0.19275900721549988,1.5956157445907593
